{
  "$schema": "https://json-schema.org/draft/2020-12/schema",
  "type": "object",
  "additionalProperties": false,
  "properties": {
    "id": {"type": "string", "minLength": 1},
    "text": {"type": "string", "minLength": 1},
    "notes": {"type": "string"},
    "skill_used": {"type": "boolean"}
  },
  "required": ["id", "text", "notes", "skill_used"]
}
