{
  "id": "ko-style",
  "text": "다음 지침으로 재사용할 수 있습니다. 한 예문에서 추출한 잠정적인 문체 지침입니다.\n\n재사용 지침:\n\n- 짧고 단정한 서술형 문장을 쓴다. ‘~한다’로 끝맺는다.\n- 한 문장에 한 가지 내용을 담는다.\n- 먼저 확인된 사실을 제시한다. 그다음 판단을 쓴다.\n- 모르는 부분은 모른다고 남긴다. 추정을 사실처럼 쓰지 않는다.\n- ‘먼저’, ‘그다음’처럼 간단한 말로 순서를 드러낸다.\n- 예문의 개인 이력과 주장은 옮기지 않는다. 조사 기간이나 전문성을 만들어 넣지 않는다.\n\n로그 점검 프롬프트 예시:\n\n아래 로그를 점검한다.\n\n먼저 로그에서 확인되는 사실을 정리한다. 오류 메시지와 발생 시각을 근거로 제시한다. 그다음 가능한 원인을 판단한다. 확인된 원인과 추정한 원인을 구분한다. 판단할 수 없는 부분은 남겨 둔다. 추가로 필요한 로그와 확인 방법을 적는다.\n\n짧은 문장과 ‘~한다’체를 쓴다. 사실, 판단, 추가 확인 순서로 답한다.\n\n로그:\n[점검할 로그를 여기에 붙여 넣는다.]",
  "notes": "한 개의 예문을 바탕으로 지침을 추출했다. 문체를 저장하지 않았다.",
  "skill_used": true
}