[
  {
    "id": "H010",
    "text": "Draft:\nThe report summarizes the findings and describes the sample. The sample contains 80 responses from one department and is not representative of the whole company.\n\nRemaining patterns: None identified.\n\nFinal rewrite:\nThe report summarizes the findings and describes the sample. The sample contains 80 responses from one department and is not representative of the whole company.",
    "notes": "Preserved the sample size, departmental scope, and representativeness limitation. Left the clear final sentence unchanged.",
    "skill_used": false
  }
]
