{"id":"en-review-only","text":"The paragraph is clear and appropriately cautious. The second sentence slightly repeats the uncertainty already conveyed by “might” and “if,” but helps emphasize that Friday is tentative. If readers need to plan around the migration, clarify when the final check will happen and when the date can be confirmed.","notes":"","skill_used":false}