{"id":"plain-explanation-no-page--original","text":"二分查找用于已经排序的数据。每轮比较目标值与中间元素，将搜索范围缩小到相应的一半（页码：未提供）。\n\n以升序数据为例：\n1. 取当前搜索范围的中间元素。\n2. 如果目标值等于中间元素，查找成功。\n3. 如果目标值更小，继续搜索左半部分；如果更大，继续搜索右半部分。\n4. 重复以上过程，直到找到目标，或搜索范围为空。范围为空表示目标不存在。\n\n排序保证了每次都能排除不可能包含目标的那一半，因此可以快速缩小搜索范围。","notes":"所供摘录未提供页码。","skill_used":false}