{"id":"zh-style","text":"可复用风格提示词：\n\n用简短、直接的句子表达。优先用“先……再……”交代顺序。先摆事实，再给判断；没有证据的地方，保留空白或明确说明尚不确定。语气克制，不加空泛评价。保留必要细节，不为了短句拆散逻辑。不借用样稿中的个人经历、身份或事实。\n\n排查日志的新提示词示例：\n\n请分析下面的日志。先看时间顺序、报错和上下文。再判断可能的原因。\n\n列出关键证据。区分日志能确认的事实和仍需验证的推测。没有证据的地方，就留白，并说明还缺什么。给出下一步验证方法，不把建议写成已经执行的操作。\n\n用短句。直接说重点。保留必要的技术名称和日志原文。\n\n日志：\n{{日志内容}}","notes":"样稿较短，只支持暂定的风格提炼；未将其中的调查经历带入新提示词。","skill_used":true}