[
  {
    "id": "ja-style",
    "text": "再利用できる文体指示：\n「短い文を使う。一文に一つの内容を書く。事実を先に示し、次に考察を書く。『まず』『次に』で順序を明確にする。落ち着いた、簡潔な常体で書く。不明なことは断定せず、不明のまま明示する。調査期間や経験は、根拠がある場合だけ具体的に書く。」\n\nログを確認するプロンプトの例：\n「以下のログを確認してください。まず、記録されている事実を時系列で示してください。次に、考えられる原因を根拠とともに示してください。事実と推測は分けてください。分からないことは『不明』と書き、確認に必要な情報を挙げてください。短い文と常体を使い、簡潔に書いてください。\n\nログ：\n［ここにログを貼る］」\n\n原文の『この会社を3年間調べた』は個別の事実です。再利用時に、そのまま流用しないでください。",
    "notes": "",
    "skill_used": false
  }
]
