{"id":"ja-style","text":"再利用できる指示：\n「短い文を使う。一文に一つの要点を書く。『まず』『次に』で順序を示す。事実を先に述べ、その後に考察を書く。分からないことは明示し、推測で埋めない。簡潔な常体で書く。」\n\nログを確認するプロンプトの例：\n「次のログを確認する。まず、記録から確認できる事実を整理する。次に、原因の候補とその根拠を書く。事実と推測を分ける。分からないことは、分からないまま残す。確認に必要な情報があれば挙げる。短い文と常体で書く。\n\nログ：\n{{ログ本文}}」","notes":"短いサンプル一つに基づく暫定的な整理です。「この会社を3年間調べた」という経歴は文体指示に引き継いでいません。使用した日本語ガイドは実験版で、母語話者による確認は未実施とされています。","skill_used":true}